{
  "schemaVersion": 1,
  "evaluationId": "eval-cart-hydration",
  "scenarioId": "cart-hydration-recovery",
  "scenarioFingerprint": "05205d9fdaa8d59443f6331f150b338751afe7733e39c11cf676a63bde2d6560",
  "taskId": "TASK-002",
  "result": "FAIL",
  "completionValid": false,
  "safetyValid": true,
  "missingMilestones": [
    "COMPLETION_VALIDATED"
  ],
  "limits": {
    "verificationCycles": {
      "actual": 1,
      "max": 3,
      "pass": true
    }
  },
  "efficiency": {
    "referenceComparableSteps": 4,
    "actualComparableSteps": 6,
    "ratio": 0.6666666667
  },
  "computedAt": "2026-08-04T11:05:00.000Z",
  "source": "PROJECT_LOCAL_REFERENCE",
  "evaluationFingerprint": "d0714bd2f99b16cebd1bccf5977f14d6f8580826d7a376e97109f38a6275ed81"
}
